{
  "$schema": "../../../../schemas/figma-color-foundation-blueprint.schema.json",
  "schemaVersion": "1.0.0",
  "id": "IOS-FND-COLOR-FIGMA",
  "milestone": "IOS-003.1",
  "status": "implemented-pending-human-review",
  "file": {
    "key": "OJqxFKoGjRh4rrSZCKdkzi",
    "name": "InterfaceOS — Design System"
  },
  "page": {
    "name": "03 Foundations",
    "id": "2:4",
    "verificationStatus": "verified"
  },
  "section": {
    "name": "Color",
    "id": "26:14",
    "captureStatus": "captured"
  },
  "layout": {
    "boardWidth": 1440,
    "boardMinHeight": 900,
    "direction": "vertical",
    "boardPadding": 64,
    "sectionGap": 48,
    "groupGap": 24,
    "itemGap": 16,
    "metadataGap": 8,
    "canvasBoardGap": 240,
    "grid": {
      "columns": 12,
      "margin": 80,
      "gutter": 24,
      "baseline": 8,
      "classification": "documentation-layout-only-not-canonical-tokens"
    }
  },
  "variablePlaceholders": [
    {
      "collection": "Primitive",
      "responsibility": "Approved raw color families and stops",
      "collectionId": "VariableCollectionId:63:14"
    },
    {
      "collection": "Semantic",
      "responsibility": "Stable product intent and component-facing color API",
      "collectionId": "VariableCollectionId:63:15"
    },
    {
      "collection": "Theme",
      "responsibility": "Light, Dark, and future theme mappings",
      "collectionId": "VariableCollectionId:63:16"
    },
    {
      "collection": "Responsive",
      "responsibility": "Cross-foundation documentation dependency only",
      "collectionId": "VariableCollectionId:63:17"
    },
    {
      "collection": "Motion",
      "responsibility": "Cross-foundation interaction dependency only",
      "collectionId": "VariableCollectionId:63:18"
    }
  ],
  "boards": [
    {
      "order": 1,
      "name": "Color / 01 Philosophy",
      "purpose": "Establish design, enterprise, AI-ready, accessibility, and originality principles.",
      "content": [
        "design-goals",
        "enterprise-principles",
        "ai-ready-principles",
        "accessibility-principles",
        "originality-principles"
      ],
      "frameId": "2:16",
      "status": "verified"
    },
    {
      "order": 2,
      "name": "Color / 02 Architecture",
      "purpose": "Document the Primitive to Theme to Semantic to consumer dependency direction.",
      "content": [
        "primitive",
        "theme",
        "semantic",
        "components",
        "patterns",
        "applications",
        "light",
        "dark",
        "future-themes"
      ],
      "frameId": "26:15",
      "status": "verified"
    },
    {
      "order": 3,
      "name": "Color / 03 Primitive Families",
      "purpose": "Show current canonical primitive families as provisional variable-bound swatches while preserving unsupported exploration lanes as explicit gaps.",
      "content": [
        "neutral",
        "green",
        "amber",
        "red",
        "primary-mapping-gap",
        "blue",
        "indigo",
        "purple",
        "teal",
        "data-colors",
        "canonical-stops-plus-explicit-gaps",
        "swatch-metadata"
      ],
      "frameId": "26:16",
      "status": "verified"
    },
    {
      "order": 4,
      "name": "Color / 04 Semantic Colors",
      "purpose": "Prepare stable intent groups and alias placeholders without values.",
      "content": [
        "neutral",
        "primary",
        "secondary",
        "tertiary",
        "success",
        "warning",
        "danger",
        "text",
        "background",
        "surface",
        "border",
        "interactive",
        "focus",
        "selection",
        "overlay",
        "disabled",
        "inverse",
        "alpha",
        "data"
      ],
      "frameId": "26:17",
      "status": "verified"
    },
    {
      "order": 5,
      "name": "Color / 05 Theme Mapping",
      "purpose": "Compare complete semantic mappings across current and future themes.",
      "content": [
        "light",
        "dark",
        "future-brand-themes",
        "future-high-contrast",
        "alias-relationships"
      ],
      "frameId": "26:18",
      "status": "verified"
    },
    {
      "order": 6,
      "name": "Color / 06 Text Hierarchy",
      "purpose": "Validate readable text emphasis on every permitted surface.",
      "content": [
        "primary",
        "secondary",
        "tertiary",
        "inverse",
        "disabled",
        "placeholder",
        "link"
      ],
      "frameId": "26:19",
      "status": "verified"
    },
    {
      "order": 7,
      "name": "Color / 07 Surface System",
      "purpose": "Define surface depth without depending on shadow.",
      "content": [
        "surface-main",
        "surface-subtle",
        "surface-strong",
        "raised",
        "overlay",
        "sunken",
        "selected",
        "disabled",
        "inverse"
      ],
      "frameId": "26:20",
      "status": "verified"
    },
    {
      "order": 8,
      "name": "Color / 08 Border System",
      "purpose": "Distinguish structure, state, and focus boundaries.",
      "content": [
        "default",
        "subtle",
        "strong",
        "interactive",
        "focus",
        "disabled",
        "inverse"
      ],
      "frameId": "26:21",
      "status": "verified"
    },
    {
      "order": 9,
      "name": "Color / 09 Alpha System",
      "purpose": "Govern compositing, permitted backgrounds, and fallbacks.",
      "content": [
        "white-alpha",
        "black-alpha",
        "overlay",
        "glass",
        "scrim",
        "transparent"
      ],
      "frameId": "26:22",
      "status": "verified"
    },
    {
      "order": 10,
      "name": "Color / 10 Interactive States",
      "purpose": "Test state ordering without creating components.",
      "content": [
        "default",
        "hover",
        "pressed",
        "focused",
        "disabled",
        "selected",
        "loading"
      ],
      "frameId": "27:14",
      "status": "verified"
    },
    {
      "order": 11,
      "name": "Color / 11 Feedback States",
      "purpose": "Distinguish operational feedback with redundant cues.",
      "content": [
        "success",
        "warning",
        "danger",
        "information",
        "neutral",
        "error-versus-danger-decision"
      ],
      "frameId": "27:15",
      "status": "verified"
    },
    {
      "order": 12,
      "name": "Color / 12 Accessibility",
      "purpose": "Consolidate contrast, ambiguity, forced-colors, focus, and review obligations.",
      "content": [
        "contrast",
        "color-vision",
        "grayscale",
        "forced-colors",
        "focus",
        "wcag-checklist",
        "do",
        "dont"
      ],
      "frameId": "27:16",
      "status": "verified"
    },
    {
      "order": 13,
      "name": "Color / 13 Dashboard Colors",
      "purpose": "Stress-test simultaneous enterprise states and dense information.",
      "content": ["charts", "status", "heatmaps", "kpis", "progress", "tables"],
      "frameId": "27:17",
      "status": "verified"
    },
    {
      "order": 14,
      "name": "Color / 14 Chart Colors",
      "purpose": "Separate visualization palettes from product status semantics.",
      "content": ["categorical", "sequential", "diverging", "heatmaps"],
      "frameId": "27:18",
      "status": "verified"
    },
    {
      "order": 15,
      "name": "Color / 15 Light Theme",
      "purpose": "Test the complete semantic model in a Light application-scale abstraction.",
      "content": [
        "application-preview",
        "semantic-placeholders",
        "accessibility-evidence"
      ],
      "frameId": "27:19",
      "status": "verified"
    },
    {
      "order": 16,
      "name": "Color / 16 Dark Theme",
      "purpose": "Mirror and independently validate the Light composition in Dark.",
      "content": [
        "mirrored-application-preview",
        "semantic-placeholders",
        "accessibility-evidence"
      ],
      "frameId": "27:20",
      "status": "verified"
    },
    {
      "order": 17,
      "name": "Color / 17 Decision Log",
      "purpose": "Preserve accepted and rejected decision rationale.",
      "content": [
        "candidate",
        "reason",
        "rejected-alternatives",
        "reviewer",
        "evidence",
        "approval-date"
      ],
      "frameId": "27:21",
      "status": "verified"
    },
    {
      "order": 18,
      "name": "Color / 18 Review & Approval",
      "purpose": "Enforce independent discipline review and release truthfulness.",
      "content": [
        "accessibility",
        "engineering",
        "design",
        "governance",
        "release"
      ],
      "frameId": "27:22",
      "status": "verified"
    }
  ],
  "constraints": {
    "createComponents": false,
    "createVariables": true,
    "createStyles": false,
    "createFinalColorValues": false,
    "publishLibrary": false,
    "componentColorDependency": "semantic-only"
  },
  "reviews": {
    "design": "pending",
    "accessibility": "pending-specialist-review",
    "engineering": "pending-specialist-review",
    "governance": "pending",
    "release": "blocked"
  }
}
